{"commands":[{"path":"commands/full.json","sha256":"69512d5c45dbc3813cc0d598d3ac2d98102a653c3177edd0c18e89d8d1d1f457","size_bytes":1488},{"path":"commands/subsystem.json","sha256":"cbded81eca4423ff144e22d6145988de72c7b8c0436dbd06c75100a9abd0c6e6","size_bytes":1204},{"path":"commands/targeted.json","sha256":"be60d455e47d5936c379ac5b0aa3f6d18e3a808e09c3143f55f2640e1085a87c","size_bytes":1114}],"dependency_inputs":[{"path":"pyproject.toml","sha256":"36cee19c14771c77f170e21d95c709a3c92813630cc1b156e872c842d9da7ecb","size_bytes":674},{"path":"environments/cuda-rtx5090-cu128.lock.txt","sha256":"b1309f089eda1914df7e87704628e367706e50203441aba775517fefa02838a2","size_bytes":2253},{"path":"docs/verification/remediation/verification-contract-v1.json","sha256":"a6441a4bf026ede3000e6021cb8d4fa8f1b1c1019aa7124f3b54444b01e0c0c2","size_bytes":1758}],"dependency_versions":[{"name":"anyio","version":"4.13.0"},{"name":"numpy","version":"2.4.4"},{"name":"pytest","version":"9.0.2"},{"name":"pytest-cov","version":"7.1.0"},{"name":"pytest-xdist","version":"3.8.0"},{"name":"scipy","version":"1.17.1"}],"environment_record":{"path":"environment.json","sha256":"f09c0f284ccd8725a52fc47304c11470ee72ad8cb40a964928a6c781afb6bcea","size_bytes":1213},"evidence_stage":"candidate","files":[{"kind":"command","path":"commands/full.json","sha256":"69512d5c45dbc3813cc0d598d3ac2d98102a653c3177edd0c18e89d8d1d1f457","size_bytes":1488},{"kind":"command","path":"commands/subsystem.json","sha256":"cbded81eca4423ff144e22d6145988de72c7b8c0436dbd06c75100a9abd0c6e6","size_bytes":1204},{"kind":"command","path":"commands/targeted.json","sha256":"be60d455e47d5936c379ac5b0aa3f6d18e3a808e09c3143f55f2640e1085a87c","size_bytes":1114},{"kind":"dependency","path":"dependencies.json","sha256":"91fbcaf941213ffac140c2e2009356a551ff8af8c891a998aaa40791b57d3f3f","size_bytes":750},{"kind":"environment","path":"environment.json","sha256":"f09c0f284ccd8725a52fc47304c11470ee72ad8cb40a964928a6c781afb6bcea","size_bytes":1213},{"kind":"junit","path":"full.xml","sha256":"af201bafe90e3dcb5c3b69b7ec49ddc188fe635de00cecc65665633e2b707468","size_bytes":179859},{"kind":"reproduced_source","path":"historical-verification.json","sha256":"8230d4f44281d179688dc47db7fbd44e474e3476a5beccc50574d585f40e2c8f","size_bytes":10630},{"kind":"plan_binding","path":"plan-binding.json","sha256":"3b478cbd5e591d2d014428834e33077e173336de783948a2bcd32f7efab91bd1","size_bytes":278},{"kind":"privacy_transform","path":"privacy-transform.json","sha256":"8d802493af3f03052c489712707553cf17edb0f98e7da589c1f9715bd104be3b","size_bytes":3285},{"kind":"junit","path":"subsystem.xml","sha256":"d212d0a3210bcf35aa8b57a5ae5df62f704aa2f27a307e534d38e3944dcf4b59","size_bytes":33831},{"kind":"junit","path":"targeted.xml","sha256":"379db5d63fd19338d3e72b4c4d1bdb112ffa653a708bbc2d061ea1aaf13af46f","size_bytes":30272}],"implementation_parent_git_head":"5ddebcfd5100705397c0f71976b6df68cfd07c35","platform":{"architecture":"AMD64","os":"Windows","python_implementation":"CPython","python_version":"3.14.4","release":"10"},"reviewed_plan_binding":{"commit":"c101b8a0e6ba534c72c22047985670a3dbcd8885","path":"docs/superpowers/plans/2026-08-11-scientific-integrity-remediation-wave-0.md","sha256":"dbe2263a3b0fe1e9f5db4ff1fca9a19f819cfd32ef38da71d6e5cb5485723ac2","size_bytes":152165},"schema_version":"remediation-evidence-index-v1","source_config_bindings":[{"path":".gitattributes","sha256":"be241157803d3f9a6f01f2f387c7e63794d8f3f02b6c03d57ec28847e7acfaf3","size_bytes":288},{"path":".gitignore","sha256":"40df406038937a706374fbb7bfd6cefc85afef41ea53ccc25045c84be22ae6bf","size_bytes":262},{"path":"docs/audits/2026-08-11-post-fixed-ray-deep-audit.md","sha256":"6c97b3f40d9163f5095ad9bed2f53d795ac1ea335063c82d564bd708026ec60e","size_bytes":21869},{"path":"docs/superpowers/plans/2026-08-11-scientific-integrity-remediation-wave-0.md","sha256":"dbe2263a3b0fe1e9f5db4ff1fca9a19f819cfd32ef38da71d6e5cb5485723ac2","size_bytes":152165},{"path":"docs/superpowers/specs/2026-08-11-scientific-integrity-remediation-program-design.md","sha256":"8db08f2edb66fc362597b69597bc522d24fdbce01ebac68153cc78ec5d37d3b5","size_bytes":53225},{"path":"docs/verification/remediation/README.md","sha256":"8745d7d44bb1e5b14b6e08f7313d3533e66ebd06494ee328bbeef27430120f92","size_bytes":3808},{"path":"docs/verification/remediation/audit-disposition-v1.json","sha256":"dbc01d3daf74f83e3edc83909999fbab53271c52aa17455cf31649aacc3046f9","size_bytes":16899},{"path":"docs/verification/remediation/compatibility-inventory-v1.json","sha256":"b765eea670a9d5de070dd627528ac74d7884a31196e74bf95bd00ff0444d5b9d","size_bytes":35716},{"path":"docs/verification/remediation/historical-fixed-ray-bundles-v1.json","sha256":"2edfacac5513afc68e2cd463b2a33b7d2301ffc4815980d180a4cc419dc5ce2f","size_bytes":5759},{"path":"docs/verification/remediation/remediation-evidence-v1.schema.json","sha256":"95e96954e28c47fe5acf16554f565ae053f9fce8c159c881a1b227182043ce61","size_bytes":8203},{"path":"docs/verification/remediation/status-failure-contract-v1.json","sha256":"c6066126ca9083c4fff4e7874d76f17daa94f8253dca8b4af7d8abb8943ff4a5","size_bytes":19584},{"path":"docs/verification/remediation/verification-contract-v1.json","sha256":"a6441a4bf026ede3000e6021cb8d4fa8f1b1c1019aa7124f3b54444b01e0c0c2","size_bytes":1758},{"path":"pyproject.toml","sha256":"36cee19c14771c77f170e21d95c709a3c92813630cc1b156e872c842d9da7ecb","size_bytes":674},{"path":"tests/test_artifacts.py","sha256":"16993162529acdfd91535bef09676935607ecd811d54f97ed4db71aaeaebd356","size_bytes":13962},{"path":"tests/test_experiment_support.py","sha256":"f70a097340a7ef99bec3f1463e7f94252c3488f5f34cb7becb3469407731b827","size_bytes":26663},{"path":"tests/test_remediation_contracts.py","sha256":"4f07427999c5a6d9a1995d14d06ba13437c940b05bdee05f7e5f2754f3eb6e11","size_bytes":25501},{"path":"tests/test_remediation_evidence.py","sha256":"c4625fac08dc2445caa790309830aa41c7ff8e257213f55a7c3987995222eabd","size_bytes":128915},{"path":"tools/build_wave0_evidence.py","sha256":"825f0a685892a0edd6b21b1a8f6f41dfd3e2710474a98875a54654ff1ca3f706","size_bytes":83376},{"path":"tools/remediation_evidence.py","sha256":"b0717684a3e4b44c9951cfc8a61b54da35b275dd7febb220af615e6f0d79d7d9","size_bytes":119632}],"tested_git_head":"5ddebcfd5100705397c0f71976b6df68cfd07c35","tested_input_inventory_sha256":"87f2d4c2e84615205e8f77bf520f28d24a8a305b3daf60707ee5d888a53a0ad7","tested_input_policy":{"exclusion_rules":["prefix:docs/verification/evidence/","prefix:verification-evidence/","prefix:.verification/","prefix:.pytest_cache/","prefix:.pytest-"],"inputs":[{"path":".gitattributes","sha256":"be241157803d3f9a6f01f2f387c7e63794d8f3f02b6c03d57ec28847e7acfaf3","size_bytes":288},{"path":".gitignore","sha256":"40df406038937a706374fbb7bfd6cefc85afef41ea53ccc25045c84be22ae6bf","size_bytes":262},{"path":"Theory/01_introduction.tex","sha256":"256e836c3439745ebc77894249aacc16dd7c48e2613dcf6b3d1769c5c2fd4f0f","size_bytes":11304},{"path":"Theory/02_geometry.tex","sha256":"8a39f1c6d2e0ac92acc159c47739b13cd7d190054563bccfe77e447edc5d9d95","size_bytes":34359},{"path":"Theory/03_probability.tex","sha256":"5cf6a326900cf373f04f6d05379df20cca0edc1cdde51a0daae9e739a9813520","size_bytes":41941},{"path":"Theory/04_generative.tex","sha256":"2a172e37b2008ce45a745eb41deeda429dfe6d1760948ecc15b196290d965e95","size_bytes":22791},{"path":"Theory/05_elbo.tex","sha256":"d6bd224135ed4cf370548729713555415b4cc0eef5f76f6c7a65853d073ff2cc","size_bytes":49605},{"path":"Theory/05a_expfamily.tex","sha256":"afb16437f45d0ff7a7fe5ffb90284d69a93f135230ced5b41b08edf8e313f86e","size_bytes":18187},{"path":"Theory/05b_local_collective_elbo.tex","sha256":"22d35509fa707e46de71e331df614ccf2aa48572cc456a02ee717a7a9dc39b60","size_bytes":35090},{"path":"Theory/05c_pullback_geometry.tex","sha256":"a035cf5f69e9179f56b2d94cb697989d15e2bb4b0b13e412bc98354342bb9196","size_bytes":67859},{"path":"Theory/05d_relational_inference.tex","sha256":"7b1d486962235465d69a105b51e6608148c4d8b4fa942adb2d4384a0ca868715","size_bytes":84440},{"path":"Theory/06_gaussian.tex","sha256":"39d827032f42a53c17b1ceded32b2247c501420dc43b2ad0fbef37fae5659fbc","size_bytes":39329},{"path":"Theory/06_general_coarsegraining.tex","sha256":"4891a8f5fa86ac0fa5266381e2c67161125645034ca40395cb2e3ed1b67dc9b2","size_bytes":33532},{"path":"Theory/06a_generative_gaussian.tex","sha256":"311288e4fc38e8313646569b3609e790501eac2e4b4627707fdd55ff01d9ffde","size_bytes":12436},{"path":"Theory/07_general_renormalization.tex","sha256":"ceda98a49f4122de39d70f784288860ab727abfa217a92b1230591e6ce76bcad","size_bytes":53716},{"path":"Theory/07_restrictions.tex","sha256":"e477589bf99c5a225d4e9d61523d1317ea66b04a9cd164e5f1a4d296c0fe9a64","size_bytes":34178},{"path":"Theory/07b_agent_network_rg.tex","sha256":"5eb159493ec727218e2eaca4cf47f3fddeb090f6e193352846ad2a43181437ca","size_bytes":136451},{"path":"Theory/08_infogeometry.tex","sha256":"a983842eec66594f8fed08866f017bcb70ebc313f36e8183ba8087b1e5ade3cd","size_bytes":45656},{"path":"Theory/09_coarsegraining.tex","sha256":"7caedf0e2e5301b7f56ffeee350ccd280bda9c2119ba40d1619a5727fe161e80","size_bytes":42455},{"path":"Theory/10_renormalization.tex","sha256":"a19ae76e82eff709c1be7228b02b69558cc95a53ae4c064ab1ae459c6c134c49","size_bytes":28169},{"path":"Theory/11_obstructions.tex","sha256":"6ece6caee1ec1425202091cf43a4b9b5ff10dedb64c4d092e7043b3ce9b35ae8","size_bytes":36223},{"path":"Theory/12_philosophy.tex","sha256":"c5d36e176832a8ee595425ef47eca2fbc81b7367885ce8189928f8b6878a8aff","size_bytes":16033},{"path":"Theory/SPEC.md","sha256":"ab59a4d02e1c475b6384403013458d39f88f170d592edf802d4c772dd7320571","size_bytes":54048},{"path":"Theory/appendix_claim_ledger.tex","sha256":"2aa6cb6d1b5a4ffc8b88d5bdf25642394ff351aca81da21633eea9345fe39e90","size_bytes":17722},{"path":"Theory/appendix_notation.tex","sha256":"09551e788dd3628c44ff6e1118790d4801014bdfea8cd61073cf32b39c30bc7d","size_bytes":31717},{"path":"Theory/appendix_numerical_provenance.tex","sha256":"b67